Book1,,,,,,,,,,,
Jupiter,"Jupiter's signature stripes and swirls are actually cold, windy clouds of ammonia and water, floating in an atmosphere of hydrogen and helium. The dark orange stripes are called belts, while the lighter bands are called zones, and they flow east and west in opposite directions. Jupiter’s iconic Great Red Spot is a giant storm bigger than Earth that has raged for hundreds of years. The king of planets was named for Jupiter, king of the gods in Roman mythology. Most of its moons are also named for mythological characters, figures associated with Jupiter or his Greek counterpart, Zeus. ","Jupiter, being the biggest planet, gets its name from the king of the ancient Roman gods.","Jupiter’s environment is probably not conducive to life as we know it. The temperatures, pressures, and materials that characterize this planet are most likely too extreme and volatile for organisms to adapt to. While planet Jupiter is an unlikely place for living things to take hold, the same is not true of some of its many moons. Europa is one of the likeliest places to find life elsewhere in our solar system. There is evidence of a vast ocean just beneath its icy crust, where life could possibly be supported.","With a radius of 43,440.7 miles (69,911 kilometers), Jupiter is 11 times wider than Earth. If Earth were the size of a grape, Jupiter would be about as big as a basketball. From an average distance of 484 million miles (778 million kilometers), Jupiter is 5.2 astronomical units away from the Sun. One astronomical unit (abbreviated as AU), is the distance from the Sun to Earth. From this distance, it takes sunlight 43 minutes to travel from the Sun to Jupiter.","Jupiter has the shortest day in the solar system. One day on Jupiter takes only about 10 hours (the time it takes for Jupiter to rotate or spin around once), and Jupiter makes a complete orbit around the Sun (a year in Jovian time) in about 12 Earth years (4,333 Earth days). Its equator is tilted with respect to its orbital path around the Sun by just 3 degrees. This means Jupiter spins nearly upright and does not have seasons as extreme as other planets do.","With four large moons and many smaller moons, Jupiter forms a kind of miniature solar system. Jupiter has 95 moons that are officially recognized by the International Astronomical Union. The four largest moons – Io, Europa, Ganymede, and Callisto – were first observed by the astronomer Galileo Galilei in 1610 using an early version of the telescope. These four moons are known today as the Galilean satellites, and they're some of the most fascinating destinations in our solar system. Io is the most volcanically active body in the solar system. Ganymede is the largest moon in the solar system (even bigger than the planet Mercury). Discovered in 1979 by NASA's Voyager 1 spacecraft, Jupiter's rings were a surprise. The rings are composed of small, dark particles, and they are difficult to see except when backlit by the Sun. Data from the Galileo spacecraft indicate that Jupiter's ring system may be formed by dust kicked up as interplanetary meteoroids smash into the giant planet's small innermost moons. Callisto’s very few small craters indicate a small degree of current surface activity. A liquid-water ocean with the ingredients for life may lie beneath the frozen crust of Europa, the target of NASA's Europa Clipper mission slated to launch in 2024.","Jupiter took shape along with rest of the solar system about 4.5 billion years ago. Gravity pulled swirling gas and dust together to form this gas giant. Jupiter took most of the mass left over after the formation of the Sun, ending up with more than twice the combined material of the other bodies in the solar system. In fact, Jupiter has the same ingredients as a star, but it did not grow massive enough to ignite. About 4 billion years ago, Jupiter settled into its current position in the outer solar system, where it is the fifth planet from the Sun.","The composition of Jupiter is similar to that of the Sun – mostly hydrogen and helium. Deep in the atmosphere, pressure and temperature increase, compressing the hydrogen gas into a liquid. This gives Jupiter the largest ocean in the solar system – an ocean made of hydrogen instead of water. Scientists think that, at depths perhaps halfway to the planet's center, the pressure becomes so great that electrons are squeezed off the hydrogen atoms, making the liquid electrically conducting like metal. Jupiter's fast rotation is thought to drive electrical currents in this region, with the spinning of the liquid metallic hydrogen acting like a dynamo, generating the planet's powerful magnetic field. Deeper down, Jupiter's central core had long been a mystery. Scientists theorized Jupiter was a mostly homogeneous mix of hydrogen and helium gases, surrounding a small, solid core of heavier elements – ice, rock, and metal formed from debris and small objects swirling around that area of the embryonic solar system 4 billion years ago. NASA’s Juno spacecraft, measuring Jupiter’s gravity and magnetic field, found data suggesting the core is much larger than expected, and not solid. Instead, it’s partially dissolved, with no clear separation from the metallic hydrogen around it, leading researchers to describe the core as dilute, or “fuzzy.""","As a gas giant, Jupiter doesn’t have a true surface. The planet is mostly swirling gases and liquids. While a spacecraft would have nowhere to land on Jupiter, it wouldn’t be able to fly through unscathed either. The extreme pressures and temperatures deep inside the planet crush, melt, and vaporize spacecraft trying to fly into the planet.","Jupiter's appearance is a tapestry of colorful stripes and spots – the cloud bands that encircle the planet, and the cyclonic storms dotting it from pole to pole. The gas planet likely has three distinct cloud layers in its ""skies"" that, taken together, span about 44 miles (71 kilometers). The top cloud is probably made of ammonia ice, while the middle layer is likely made of ammonium hydrosulfide crystals. The innermost layer may be made of water ice and vapor. The vivid colors you see in thick bands across Jupiter may be plumes of sulfur and phosphorus-containing gases rising from the planet's warmer interior. Jupiter's fast rotation – spinning once every 10 hours – creates strong jet streams, separating its clouds into dark belts and bright zones across long stretches. With no solid surface to slow them down, Jupiter's spots can persist for many years. Stormy Jupiter is swept by over a dozen prevailing winds, some reaching up to 335 miles per hour (539 kilometers per hour) at the equator. The Great Red Spot, a swirling oval of clouds twice as wide as Earth, has been observed on the giant planet for more than 300 years. More recently, three smaller ovals merged to form the Little Red Spot, about half the size of its larger cousin. Findings from NASA’s Juno probe released in October 2021 provide a fuller picture of what’s going on below those clouds. Data from Juno shows that Jupiter’s cyclones are warmer on top, with lower atmospheric densities, while they are colder at the bottom, with higher densities. Anticyclones, which rotate in the opposite direction, are colder at the top but warmer at the bottom. The findings also indicate these storms are far taller than expected, with some extending 60 miles (100 kilometers) below the cloud tops and others, including the Great Red Spot, extending over 200 miles (350 kilometers). This surprising discovery demonstrates that the vortices cover regions beyond those where water condenses and clouds form, below the depth where sunlight warms the atmosphere. The height and size of the Great Red Spot mean the concentration of atmospheric mass within the storm potentially could be detectable by instruments studying Jupiter’s gravity field. Two close Juno flybys over Jupiter’s most famous spot provided the opportunity to search for the storm’s gravity signature and complement the other results on its depth. With their gravity data, the Juno team was able to constrain the extent of the Great Red Spot to a depth of about 300 miles (500 kilometers) below the cloud tops. Belts and Zones In addition to cyclones and anticyclones, Jupiter is known for its distinctive belts and zones – white and reddish bands of clouds that wrap around the planet. Strong east-west winds moving in opposite directions separate the bands. Juno previously discovered that these winds, or jet streams, reach depths of about 2,000 miles (roughly 3,200 kilometers). Researchers are still trying to solve the mystery of how the jet streams form. Data collected by Juno during multiple passes reveal one possible clue: that the atmosphere’s ammonia gas travels up and down in remarkable alignment with the observed jet streams. Juno’s data also shows that the belts and zones undergo a transition around 40 miles (65 kilometers) beneath Jupiter’s water clouds. At shallow depths, Jupiter’s belts are brighter in microwave light than the neighboring zones. But at deeper levels, below the water clouds, the opposite is true – which reveals a similarity to our oceans. Polar Cyclones Juno previously discovered polygonal arrangements of giant cyclonic storms at both of Jupiter’s poles – eight arranged in an octagonal pattern in the north and five arranged in a pentagonal pattern in the south. Over time, mission scientists determined these atmospheric phenomena are extremely resilient, remaining in the same location. Juno data also indicates that, like hurricanes on Earth, these cyclones want to move poleward, but cyclones located at the center of each pole push them back. This balance explains where the cyclones reside and the different numbers at each pole.","The Jovian magnetosphere is the region of space influenced by Jupiter's powerful magnetic field. It balloons 600,000 to 2 million miles (1 to 3 million kilometers) toward the Sun (seven to 21 times the diameter of Jupiter itself) and tapers into a tadpole-shaped tail extending more than 600 million miles (1 billion kilometers) behind Jupiter, as far as Saturn's orbit. Jupiter's enormous magnetic field is 16 to 54 times as powerful as that of the Earth. It rotates with the planet and sweeps up particles that have an electric charge. Near the planet, the magnetic field traps swarms of charged particles and accelerates them to very high energies, creating intense radiation that bombards the innermost moons and can damage spacecraft. Jupiter's magnetic field also causes some of the solar system's most spectacular aurorae at the planet's poles."
Saturn,"Like fellow gas giant Jupiter, Saturn is a massive ball made mostly of hydrogen and helium. Saturn is not the only planet to have rings, but none are as spectacular or as complex as Saturn's. Saturn also has dozens of moons. From the jets of water that spray from Saturn's moon Enceladus to the methane lakes on smoggy Titan, the Saturn system is a rich source of scientific discovery and still holds many mysteries.","The farthest planet from Earth discovered by the unaided human eye, Saturn has been known since ancient times. The planet is named for the Roman god of agriculture and wealth, who was also the father of Jupiter.","Saturn's environment is not conducive to life as we know it. The temperatures, pressures, and materials that characterize this planet are most likely too extreme and volatile for organisms to adapt to. While planet Saturn is an unlikely place for living things to take hold, the same is not true of some of its many moons. Satellites like Enceladus and Titan, home to internal oceans, could possibly support life.","With an equatorial diameter of about 74,897 miles (120,500 kilometers), Saturn is 9 times wider than Earth. If Earth were the size of a nickel, Saturn would be about as big as a volleyball. From an average distance of 886 million miles (1.4 billion kilometers), Saturn is 9.5 astronomical units away from the Sun. One astronomical unit (abbreviated as AU), is the distance from the Sun to Earth. From this distance, it takes sunlight 80 minutes to travel from the Sun to Saturn.","Saturn has the second-shortest day in the solar system. One day on Saturn takes only 10.7 hours (the time it takes for Saturn to rotate or spin around once), and Saturn makes a complete orbit around the Sun (a year in Saturnian time) in about 29.4 Earth years (10,756 Earth days). Its axis is tilted by 26.73 degrees with respect to its orbit around the Sun, which is similar to Earth's 23.5-degree tilt. This means that, like Earth, Saturn experiences seasons.","Saturn is home to a vast array of intriguing and unique worlds. From the haze-shrouded surface of Titan to crater-riddled Phoebe, each of Saturn's moons tells another piece of the story surrounding the Saturn system. As of June 8, 2023, Saturn has 146 moons in its orbit, with others continually awaiting confirmation of their discovery and official naming by the International Astronomical Union (IAU). Saturn's rings are thought to be pieces of comets, asteroids, or shattered moons that broke up before they reached the planet, torn apart by Saturn's powerful gravity. They are made of billions of small chunks of ice and rock coated with other materials such as dust. The ring particles mostly range from tiny, dust-sized icy grains to chunks as big as a house. A few particles are as large as mountains. The rings would look mostly white if you looked at them from the cloud tops of Saturn, and interestingly, each ring orbits at a different speed around the planet. Saturn's ring system extends up to 175,000 miles (282,000 kilometers) from the planet, yet the vertical height is typically about 30 feet (10 meters) in the main rings. Named alphabetically in the order they were discovered, the rings are relatively close to each other, with the exception of a gap measuring 2,920 miles (4,700 kilometers) in width called the Cassini Division that separates Rings A and B. The main rings are A, B, and C. Rings D, E, F, and G are fainter and more recently discovered. Starting at Saturn and moving outward, there is the D ring, C ring, B ring, Cassini Division, A ring, F ring, G ring, and finally, the E ring. Much farther out, there is the very faint Phoebe ring in the orbit of Saturn's moon Phoebe.","Saturn took shape when the rest of the solar system formed about 4.5 billion years ago when gravity pulled swirling gas and dust in to become this gas giant. About 4 billion years ago, Saturn settled into its current position in the outer solar system, where it is the sixth planet from the Sun. Like Jupiter, Saturn is mostly made of hydrogen and helium, the same two main components that make up the Sun.","Like Jupiter, Saturn is made mostly of hydrogen and helium. At Saturn's center is a dense core of metals like iron and nickel surrounded by rocky material and other compounds solidified by intense pressure and heat. It is enveloped by liquid metallic hydrogen inside a layer of liquid hydrogen –similar to Jupiter's core but considerably smaller. It's hard to imagine, but Saturn is the only planet in our solar system with an average density that is less than water. The giant gas planet could float in a bathtub if such a colossal thing existed.","As a gas giant, Saturn doesn’t have a true surface. The planet is mostly swirling gases and liquids deeper down. While a spacecraft would have nowhere to land on Saturn, it wouldn’t be able to fly through unscathed either. The extreme pressures and temperatures deep inside the planet would crush, melt, and vaporize any spacecraft trying to fly into the planet.","Saturn is blanketed with clouds that appear as faint stripes, jet streams, and storms. The planet is many different shades of yellow, brown, and gray. Winds in the upper atmosphere reach 1,600 feet per second (500 meters per second) in the equatorial region. In contrast, the strongest hurricane-force winds on Earth top out at about 360 feet per second (110 meters per second). And the pressure – the same kind you feel when you dive deep underwater – is so powerful it squeezes gas into a liquid. Saturn's north pole has an interesting atmospheric feature – a six-sided jet stream. This hexagon-shaped pattern was first noticed in images from the Voyager I spacecraft and has been more closely observed by the Cassini spacecraft since. Spanning about 20,000 miles (30,000 kilometers) across, the hexagon is a wavy jet stream of 200-mile-per-hour winds (about 322 kilometers per hour) with a massive, rotating storm at the center. There is no weather feature like it anywhere else in the solar system.","Saturn's magnetic field is smaller than Jupiter's but still 578 times as powerful as Earth's. Saturn, the rings, and many of the satellites lie totally within Saturn's enormous magnetosphere, the region of space in which the behavior of electrically charged particles is influenced more by Saturn's magnetic field than by the solar wind. Aurorae occur when charged particles spiral into a planet's atmosphere along magnetic field lines. On Earth, these charged particles come from the solar wind. Cassini showed that at least some of Saturn's aurorae are like Jupiter's and are largely unaffected by the solar wind. Instead, these aurorae are caused by a combination of particles ejected from Saturn's moons and Saturn's magnetic field's rapid rotation rate. But these ""non-solar-originating"" aurorae are not completely understood yet."
Uranus,"Uranus is a very cold and windy world. The ice giant is surrounded by 13 faint rings and 28 small moons. Uranus rotates at a nearly 90-degree angle from the plane of its orbit. This unique tilt makes Uranus appear to spin sideways, orbiting the Sun like a rolling ball. Uranus was the first planet found with the aid of a telescope. It was discovered in 1781 by astronomer William Herschel, although he originally thought it was either a comet or a star. It was two years later that the object was universally accepted as a new planet, in part because of observations by astronomer Johann Elert Bode.","William Herschel tried unsuccessfully to name his discovery Georgium Sidus after King George III. Instead, the planet was named for Uranus, the Greek god of the sky, as suggested by Johann Bode.","Uranus' environment is not conducive to life as we know it. The temperatures, pressures, and materials that characterize this planet are most likely too extreme and volatile for organisms to adapt to.","With an equatorial diameter of 31,763 miles (51,118 kilometers), Uranus is four times wider than Earth. If Earth was the size of a nickel, Uranus would be about as big as a softball. From an average distance of 1.8 billion miles (2.9 billion kilometers), Uranus is about 19 astronomical units away from the Sun. One astronomical unit (abbreviated as AU), is the distance from the Sun to Earth. From this distance, it takes sunlight 2 hours and 40 minutes to travel from the Sun to Uranus.","One day on Uranus takes about 17 hours. This is the amount of time it takes Uranus to rotate, or spin once around its axis. Uranus makes a complete orbit around the Sun (a year in Uranian time) in about 84 Earth years (30,687 Earth days). Uranus is the only planet whose equator is nearly at a right angle to its orbit, with a tilt of 97.77 degrees. This may be the result of a collision with an Earth-sized object long ago. This unique tilt causes Uranus to have the most extreme seasons in the solar system. For nearly a quarter of each Uranian year, the Sun shines directly over each pole, plunging the other half of the planet into a 21-year-long, dark winter. Uranus is also one of just two planets that rotate in the opposite direction than most of the planets. Venus is the other.","Uranus has 28 known moons. While most of the satellites orbiting other planets take their names from Greek or Roman mythology, Uranus' moons are unique in being named for characters from the works of William Shakespeare and Alexander Pope. All of Uranus' inner moons appear to be roughly half water ice and half rock. The composition of the outer moons remains unknown, but they are likely captured asteroids. Uranus has two sets of rings. The inner system of nine rings consists mostly of narrow, dark grey rings. There are two outer rings: the innermost one is reddish like dusty rings elsewhere in the solar system, and the outer ring is blue like Saturn's E ring. In order of increasing distance from the planet, the rings are called Zeta, 6, 5, 4, Alpha, Beta, Eta, Gamma, Delta, Lambda, Epsilon, Nu, and Mu. Some of the larger rings are surrounded by belts of fine dust.","Uranus took shape when the rest of the solar system formed about 4.5 billion years ago – when gravity pulled swirling gas and dust in to become this ice giant. Like its neighbor Neptune, Uranus likely formed closer to the Sun and moved to the outer solar system about 4 billion years ago, where it is the seventh planet from the Sun.","Uranus is one of two ice giants in the outer solar system (the other is Neptune). Most (80% or more) of the planet's mass is made up of a hot dense fluid of ""icy"" materials – water, methane, and ammonia – above a small rocky core. Near the core, it heats up to 9,000 degrees Fahrenheit (4,982 degrees Celsius). Uranus is slightly larger in diameter than its neighbor Neptune, yet smaller in mass. It is the second least dense planet; Saturn is the least dense of all. Uranus gets its blue-green color from methane gas in the atmosphere. Sunlight passes through the atmosphere and is reflected back out by Uranus' cloud tops. Methane gas absorbs the red portion of the light, resulting in a blue-green color.","As an ice giant, Uranus doesn’t have a true surface. The planet is mostly swirling fluids. While a spacecraft would have nowhere to land on Uranus, it wouldn’t be able to fly through its atmosphere unscathed either. The extreme pressures and temperatures would destroy a metal spacecraft. ","Uranus' atmosphere is mostly hydrogen and helium, with a small amount of methane and traces of water and ammonia. The methane gives Uranus its signature blue color. While Voyager 2 saw only a few discrete clouds, a Great Dark Spot, and a small dark spot during its flyby in 1986 – more recent observations reveal that Uranus exhibits dynamic clouds as it approaches equinox, including rapidly changing bright features. Uranus' planetary atmosphere, with a minimum temperature of 49K (-224.2 degrees Celsius) makes it even colder than Neptune in some places. Wind speeds can reach up to 560 miles per hour (900 kilometers per hour) on Uranus. Winds are retrograde at the equator, blowing in the reverse direction of the planet’s rotation. But closer to the poles, winds shift to a prograde direction, flowing with Uranus' rotation.","Uranus has an unusual, irregularly shaped magnetosphere. Magnetic fields are typically in alignment with a planet's rotation, but Uranus' magnetic field is tipped over: the magnetic axis is tilted nearly 60 degrees from the planet's axis of rotation, and is also offset from the center of the planet by one-third of the planet's radius. Uranus has auroras, but they are not in line with the poles like they are on Earth, Jupiter, and Saturn. This is due to the planet's lopsided magnetic field. The magnetosphere tail behind Uranus opposite the Sun extends into space for millions of miles. Its magnetic field lines are twisted by Uranus’ sideways rotation into a long corkscrew shape."