Book1,,,,,,,,,,,
Name,Introduction,Namesake,Potential for Life,Size and Distance,Orbit and Rotation,Moons and Rings,Formation,Structure,Surface,Atmosphere,Magnetosphere
Mercury,"Mercury is the smallest planet in our solar system, only slightly larger than Earth's Moon. From Mercury's surface, the Sun would appear over 3 times as large as it does from Earth, and the sunlight would be up to 7 times brighter. Mercury has extreme surface temperatures, reaching highs of 800°F (430°C) during the day, but dropping to -290°F (-180°C) at night due to the lack of an atmosphere. Despite being closest to the Sun, Mercury is not the hottest planet - that title belongs to Venus due to its dense atmosphere. Mercury is the fastest planet, orbiting the Sun every 88 Earth days.",Mercury is named after the swift Roman god.,Mercury's extreme temperatures and solar radiation make it inhospitable for life as we know it.,"Mercury has a radius of 1,516 miles (2,440 km), about 1/3 the width of Earth. Mercury orbits the Sun at an average distance of 36 million miles (58 million km), or 0.4 astronomical units.","Mercury has a highly eccentric, egg-shaped orbit ranging from 29 million to 43 million miles from the Sun. It completes one orbit around the Sun every 88 days, travelling at nearly 29 miles/s (47 km/s). Mercury's slow rotation of one Earth day every 59 Earth days results in a solar day (full day-night cycle) of 176 Earth days. Mercury's axis is tilted only 2 degrees, so it does not experience seasons like other planets.",Mercury has no moons or rings.,Mercury formed about 4.5 billion years ago from the gravity-driven accretion of gas and dust.,"Mercury is the second densest planet after Earth, with a large molten/liquid metal core making up 85% of its radius. The outer shell (mantle and crust) is only about 250 miles (400 km) thick.","Mercury's surface is heavily cratered, similar to the Moon's, from ancient asteroid and comet impacts. Large impact basins like the Caloris Basin were formed early in the solar system. The surface appears greyish-brown, with bright ""crater ray"" streaks formed by the crushed rock ejected from impacts. Temperatures can range from 800°F (430°C) in the day to -290°F (-180°C) at night. Mercury may have water ice in permanently shadowed polar craters.","Mercury has a thin ""exosphere"" made up of atoms blasted off the surface, rather than a full atmosphere. The exosphere is composed mainly of oxygen, sodium, hydrogen, helium, and potassium.","Mercury has a weak magnetic field offset from its equator, interacting with the solar wind to create intense magnetic tornadoes."
Venus,"Venus is the second planet from the Sun and Earth's closest planetary neighbour. It is the third brightest object in the sky after the Sun and Moon. Venus spins slowly in the opposite direction from most planets. Venus is similar in structure and size to Earth, and is sometimes called Earth's ""evil twin"". Its thick atmosphere traps heat in a runaway greenhouse effect, making it the hottest planet in the solar system.Below the dense clouds, the surface has volcanoes and deformed mountains. ","Venus is named after the ancient Roman goddess of love and beauty, known as Aphrodite to the ancient Greeks. Most features on Venus are named for women.","Temperatures 30 miles up in Venus' atmosphere range from 86-158°F, within the range for Earthly life like microbes. Atmospheric pressure at that height is similar to Earth's surface. Dark streaks in the clouds may be fine particles, ice crystals, or even microbial life adapted to the harsh conditions. Some Russian probes detected particles the size of Earth bacteria in Venus' lower atmosphere.","Venus orbits the Sun at an average distance of 67 million miles, or 0.72 astronomical units. Venus has a diameter of about 7,521 miles, compared to Earth's 7,926 milesFrom Earth, Venus is the brightest object in the night sky after the Moon.","A day on Venus lasts 243 Earth days, longer than a Venusian year of 225 Earth days. Sunrise to sunset takes 117 Earth days, with the Sun rising in the west and setting in the east due to Venus' backwards rotation. Venus has a very slight tilt of only 3 degrees, so it experiences no noticeable seasons.","Venus is one of only two planets without natural moons, but it does have a quasi-satellite named Zephyr.","A critical question for scientists who search for life among the stars: How do habitable planets get their start? The close similarities of early Venus and Earth, and their very different fates, provide a kind of test case for scientists who study planet formation. Similar size, similar interior structure, both harboring oceans in their younger days. Yet one is now an inferno, while the other is the only known world to host abundant life. The factors that set these planets on almost opposite paths began, most likely, in the swirling disk of gas and dust from which they were born. Somehow, 4.6 billion years ago that disk around our Sun accreted, cooled, and settled into the planets we know today. Better knowledge of the formation history of Venus could help us better understand Earth – and rocky planets around other stars.","If we could slice Venus and Earth in half, pole to pole, and place them side by side, they would look remarkably similar. Each planet has an iron core enveloped by a hot-rock mantle; the thinnest of skins forms a rocky, exterior crust. On both planets, this thin skin changes form and sometimes erupts into volcanoes in response to the ebb and flow of heat and pressure deep beneath. On Earth, the slow movement of continents over thousands and millions of years reshapes the surface, a process known as “plate tectonics.” Something similar might have happened on Venus early in its history. Today a key element of this process could be operating: subduction, or the sliding of one continental “plate” beneath another, which can also trigger volcanoes. Subduction is believed to be the first step in creating plate tectonics. NASA’s Magellan spacecraft, which ended a five-year mission to Venus in 1994, mapped the broiling surface using radar. Magellan saw a land of extreme volcanism – a relatively young surface, one recently reshaped (in geologic terms), and chains of towering mountains.","The Soviet Union sent a series of probes to Venus between 1961 and 1984 as part of its Venera program (Venera is Russian for Venus). Ten probes made it to the surface, and a few functioned briefly after landing. The longest survivor lasted two hours; the shortest, 23 minutes. Photos snapped before the landers fried show a barren, dim, and rocky landscape, and a sky that is likely some shade of sulfur yellow. Volcanoes and tectonic forces appear to have erased most traces of the early surface of Venus. Newer computer models indicate the resurfacing may have happened piecemeal over an extended period of time. The average age of surface features could be as young as 150 million years, with some older surfaces mixed in. Venus has valleys and high mountains dotted with thousands of volcanoes. Its surface features – most named for both real and mythical women – include Ishtar Terra, a rocky, highland area around the size of Australia near the north pole, and an even larger, South-America-sized region called Aphrodite Terra that stretches across the equator. One mountain reaches 36,000 feet (11 kilometers), higher than Mt. Everest. Notably, except for Earth, Venus has by far the fewest impact craters of any rocky planet.","Venus’ atmosphere is one of extremes. With the hottest surface in the solar system, apart from the Sun itself, Venus is hotter even than the innermost planet, charbroiled Mercury. The atmosphere is mostly carbon dioxide – the same gas driving the greenhouse effect on Venus and Earth – with clouds composed of sulfuric acid. And at the surface, the hot, high-pressure carbon dioxide behaves in a corrosive fashion. But higher up in the atmosphere, temperatures and pressure begin to ease.","Even though Venus is similar in size to Earth and has a similar-sized iron core, the planet does not have its own internally generated magnetic field. Instead, Venus has what is known as an induced magnetic field. This weak magnetic field is created by the interaction of the Sun's magnetic field and the planet's outer atmosphere. Ultraviolet light from the Sun excites gases in Venus' outermost atmosphere; these electrically excited gases are called ions, and thus this region is called the ionosphere (Earth has an ionosphere as well). The solar wind – a million-mile-per-hour gale of electrically charged particles streaming continuously from the Sun – carries with it the Sun's magnetic field. When the Sun's magnetic field interacts with the electrically excited ionosphere of Venus, it creates or induces, a magnetic field there. This induced magnetic field envelops the planet and is shaped like an extended teardrop, or the tail of a comet, as the solar wind blows past Venus and outward into the solar system."
Earth,"Earth – our home planet – is the third planet from the Sun, and the fifth largest planet. It's the only place we know of inhabited by living things. While Earth is only the fifth largest planet in the solar system, it is the only world in our solar system with liquid water on the surface. Just slightly larger than nearby Venus, Earth is the biggest of the four planets closest to the Sun, all of which are made of rock and metal. Earth is the only planet in the solar system whose English name does not come from Greek or Roman mythology. The name was taken from Old English and Germanic. It simply means ""the ground."" There are, of course, many names for our planet in the thousands of languages spoken by the people of the third planet from the Sun.","The name Earth is at least 1,000 years old. All of the planets, except for Earth, were named after Greek and Roman gods and goddesses. However, the name Earth is a Germanic word, which simply means “the ground.”","Earth has a very hospitable temperature and mix of chemicals that have made life abundant here. Most notably, Earth is unique in that most of our planet is covered in liquid water, since the temperature allows liquid water to exist for extended periods of time. Earth's vast oceans provided a convenient place for life to begin about 3.8 billion years ago. Some of the features of our planet that make it great for sustaining life are changing due to the ongoing effects of climate change.","With an equatorial diameter of 7926 miles (12,760 kilometers), Earth is the biggest of the terrestrial planets and the fifth largest planet in our solar system. From an average distance of 93 million miles (150 million kilometers), Earth is exactly one astronomical unit away from the Sun because one astronomical unit (abbreviated as AU), is the distance from the Sun to Earth. This unit provides an easy way to quickly compare planets' distances from the Sun. It takes about eight minutes for light from the Sun to reach our planet.","As Earth orbits the Sun, it completes one rotation every 23.9 hours. It takes 365.25 days to complete one trip around the Sun. That extra quarter of a day presents a challenge to our calendar system, which counts one year as 365 days. To keep our yearly calendars consistent with our orbit around the Sun, every four years we add one day. That day is called a leap day, and the year it's added to is called a leap year. Earth's axis of rotation is tilted 23.4 degrees with respect to the plane of Earth's orbit around the Sun. This tilt causes our yearly cycle of seasons. During part of the year, the northern hemisphere is tilted toward the Sun, and the southern hemisphere is tilted away. With the Sun higher in the sky, solar heating is greater in the north producing summer there. Less direct solar heating produces winter in the south. Six months later, the situation is reversed. When spring and fall begin, both hemispheres receive roughly equal amounts of heat from the Sun.","Earth is the only planet that has a single moon. Earth sometimes temporarily hosts orbiting asteroids or large rocks. They are typically trapped by Earth's gravity for a few months or years before returning to an orbit around the Sun. Some asteroids will be in a long “dance” with Earth as both orbit the Sun. Some moons are bits of rock that were captured by a planet's gravity, but our Moon is likely the result of a collision billions of years ago. When Earth was a young planet, a large chunk of rock smashed into it, displacing a portion of Earth's interior. The resulting chunks clumped together and formed our Moon. With a radius of 1,080 miles (1,738 kilometers), the Moon is the fifth largest moon in our solar system (after Ganymede, Titan, Callisto, and Io). The Moon is an average of 238,855 miles (384,400 kilometers) away from Earth. That means 30 Earth-sized planets could fit in between Earth and its Moon.","When the solar system settled into its current layout about 4.5 billion years ago, Earth formed when gravity pulled swirling gas and dust in to become the third planet from the Sun. Like its fellow terrestrial planets, Earth has a central core, a rocky mantle, and a solid crust.","Earth is composed of four main layers, starting with an inner core at the planet's center, enveloped by the outer core, mantle, and crust. The inner core is a solid sphere made of iron and nickel metals about 759 miles (1,221 kilometers) in radius. There the temperature is as high as 9,800 degrees Fahrenheit (5,400 degrees Celsius). Surrounding the inner core is the outer core. This layer is about 1,400 miles (2,300 kilometers) thick, made of iron and nickel fluids. miles (1,221 kilometers) in radius. There the temperature is as high as 9,800 degrees Fahrenheit (5,400 degrees Celsius). Surrounding the inner core is the outer core. This layer is about 1,400 miles (2,300 kilometers) thick, made of iron and nickel fluids. In between the outer core and crust is the mantle, the thickest layer. This hot, viscous mixture of molten rock is about 1,800 miles (2,900 kilometers) thick and has the consistency of caramel. The outermost layer, Earth's crust, goes about 19 miles (30 kilometers) deep on average on land. At the bottom of the ocean, the crust is thinner and extends about 3 miles (5 kilometers) from the seafloor to the top of the mantle.","Like Mars and Venus, Earth has volcanoes, mountains, and valleys. Earth's lithosphere, which includes the crust (both continental and oceanic) and the upper mantle, is divided into huge plates that are constantly moving. For example, the North American plate moves west over the Pacific Ocean basin, roughly at a rate equal to the growth of our fingernails. Earthquakes result when plates grind past one another, ride up over one another, collide to make mountains, or split and separate. Earth's global ocean, which covers nearly 70% of the planet's surface, has an average depth of about 2.5 miles (4 kilometers) and contains 97% of Earth's water. Almost all of Earth's volcanoes are hidden under these oceans. Hawaii's Mauna Kea volcano is taller from base to summit than Mount Everest, but most of it is underwater. Earth's longest mountain range is also underwater, at the bottom of the Arctic and Atlantic oceans. It is four times longer than the Andes, Rockies and Himalayas combined.","Near the surface, Earth has an atmosphere that consists of 78% nitrogen, 21% oxygen, and 1% other gases such as argon, carbon dioxide, and neon. The atmosphere affects Earth's long-term climate and short-term local weather and shields us from much of the harmful radiation coming from the Sun. It also protects us from meteoroids, most of which burn up in the atmosphere, seen as meteors in the night sky, before they can strike the surface as meteorites.","Our planet's rapid rotation and molten nickel-iron core give rise to a magnetic field, which the solar wind distorts into a teardrop shape in space. (The solar wind is a stream of charged particles continuously ejected from the Sun.) When charged particles from the solar wind become trapped in Earth's magnetic field, they collide with air molecules above our planet's magnetic poles. These air molecules then begin to glow and cause aurorae, or the northern and southern lights. The magnetic field is what causes compass needles to point to the North Pole regardless of which way you turn. But the magnetic polarity of Earth can change, flipping the direction of the magnetic field. The geologic record tells scientists that a magnetic reversal takes place about every 400,000 years on average, but the timing is very irregular. As far as we know, such a magnetic reversal doesn't cause any harm to life on Earth, and a reversal is very unlikely to happen for at least another thousand years. But when it does happen, compass needles are likely to point in many different directions for a few centuries while the switch is being made. And after the switch is completed, they will all point south instead of north."
Mars,"Mars is one of the most explored bodies in our solar system, and it's the only planet where we've sent rovers to roam the alien landscape. NASA missions have found lots of evidence that Mars was much wetter and warmer, with a thicker atmosphere, billions of years ago. Mars was named by the Romans for their god of war because its reddish color was reminiscent of blood. The Egyptians called it ""Her Desher,"" meaning ""the red one.""Even today, it is frequently called the ""Red Planet"" because iron minerals in the Martian dirt oxidize, or rust, causing the surface to look red.","Mars was named by the ancient Romans for their god of war because its reddish color was reminiscent of blood. Other civilizations also named the planet for this attribute – for example, the Egyptians called it ""Her Desher,"" meaning ""the red one."" Even today, it is frequently called the ""Red Planet"" because iron minerals in the Martian dirt oxidize, or rust, causing the surface to look red.","Scientists don't expect to find living things currently thriving on Mars. Instead, they're looking for signs of life that existed long ago, when Mars was warmer and covered with water.","With a radius of 2,106 miles (3,390 kilometers), Mars is about half the size of Earth. If Earth were the size of a nickel, Mars would be about as big as a raspberry. From an average distance of 142 million miles (228 million kilometers), Mars is 1.5 astronomical units away from the Sun. One astronomical unit (abbreviated as AU), is the distance from the Sun to Earth. From this distance, it takes sunlight 13 minutes to travel from the Sun to Mars.","As Mars orbits the Sun, it completes one rotation every 24.6 hours, which is very similar to one day on Earth (23.9 hours). Martian days are called sols – short for ""solar day."" A year on Mars lasts 669.6 sols, which is the same as 687 Earth days. Mars' axis of rotation is tilted 25 degrees with respect to the plane of its orbit around the Sun. This is another similarity with Earth, which has an axial tilt of 23.4 degrees. Like Earth, Mars has distinct seasons, but they last longer than seasons here on Earth since Mars takes longer to orbit the Sun (because it's farther away). And while here on Earth the seasons are evenly spread over the year, lasting 3 months (or one quarter of a year), on Mars the seasons vary in length because of Mars' elliptical, egg-shaped orbit around the Sun. Spring in the northern hemisphere (autumn in the southern) is the longest season at 194 sols. Autumn in the northern hemisphere (spring in the southern) is the shortest at 142 days. Northern winter/southern summer is 154 sols, and northern summer/southern winter is 178 sols.","Mars has two small moons, Phobos and Deimos, that may be captured asteroids. They're potato-shaped because they have too little mass for gravity to make them spherical. The moons get their names from the horses that pulled the chariot of the Greek god of war, Ares.","When the solar system settled into its current layout about 4.5 billion years ago, Mars formed when gravity pulled swirling gas and dust in to become the fourth planet from the Sun. Mars is about half the size of Earth, and like its fellow terrestrial planets, it has a central core, a rocky mantle, and a solid crust.","Mars has a dense core at its center between 930 and 1,300 miles (1,500 to 2,100 kilometers) in radius. It's made of iron, nickel, and sulfur. Surrounding the core is a rocky mantle between 770 and 1,170 miles (1,240 to 1,880 kilometers) thick, and above that, a crust made of iron, magnesium, aluminum, calcium, and potassium. This crust is between 6 and 30 miles (10 to 50 kilometers) deep.","The Red Planet is actually many colors. At the surface, we see colors such as brown, gold, and tan. The reason Mars looks reddish is due to oxidization – or rusting – of iron in the rocks, regolith (Martian “soil”), and dust of Mars. This dust gets kicked up into the atmosphere and from a distance makes the planet appear mostly red. Interestingly, while Mars is about half the diameter of Earth, its surface has nearly the same area as Earth’s dry land. Its volcanoes, impact craters, crustal movement, and atmospheric conditions such as dust storms have altered the landscape of Mars over many years, creating some of the solar system's most interesting topographical features. A large canyon system called Valles Marineris is long enough to stretch from California to New York – more than 3,000 miles (4,800 kilometers). This Martian canyon is 200 miles (320 kilometers) at its widest and 4.3 miles (7 kilometers) at its deepest. That's about 10 times the size of Earth's Grand Canyon. Mars is home to the largest volcano in the solar system, Olympus Mons. It's three times taller than Earth's Mt. Everest with a base the size of the state of New Mexico. Mars appears to have had a watery past, with ancient river valley networks, deltas, and lakebeds, as well as rocks and minerals on the surface that could only have formed in liquid water. Some features suggest that Mars experienced huge floods about 3.5 billion years ago. There is water on Mars today, but the Martian atmosphere is too thin for liquid water to exist for long on the surface. Today, water on Mars is found in the form of water-ice just under the surface in the polar regions as well as in briny (salty) water, which seasonally flows down some hillsides and crater walls.","Mars has a thin atmosphere made up mostly of carbon dioxide, nitrogen, and argon gases. To our eyes, the sky would be hazy and red because of suspended dust instead of the familiar blue tint we see on Earth. Mars' sparse atmosphere doesn't offer much protection from impacts by such objects as meteorites, asteroids, and comets. The temperature on Mars can be as high as 70 degrees Fahrenheit (20 degrees Celsius) or as low as about -225 degrees Fahrenheit (-153 degrees Celsius). And because the atmosphere is so thin, heat from the Sun easily escapes this planet. If you were to stand on the surface of Mars on the equator at noon, it would feel like spring at your feet (75 degrees Fahrenheit or 24 degrees Celsius) and winter at your head (32 degrees Fahrenheit or 0 degrees Celsius). Occasionally, winds on Mars are strong enough to create dust storms that cover much of the planet. After such storms, it can be months before all of the dust settles.","Mars has no global magnetic field today, but areas of the Martian crust in the southern hemisphere are highly magnetized, indicating traces of a magnetic field from 4 billion years ago."
